{"$schema":"https://json-schema.org/draft/2020-12/schema","type":"object","required":["schemaVersion","projectId","brainVersion","objectiveVersion","currentPhase","currentGate","status","baselineHead","lastVerifiedHead","completedGates","currentTaskIds","pendingTasks","blockers","pendingApprovals","lastRunId","lastExecutionReportId","lastDecisionId","tests","lint","typecheck","build","updatedAt","updatedBy"],"properties":{"schemaVersion":{"const":1},"projectId":{"type":"string"},"brainVersion":{"type":"integer","minimum":1},"objectiveVersion":{"type":"integer","minimum":1},"currentPhase":{"type":"string"},"currentGate":{"type":"string"},"status":{"enum":["NOT_STARTED","IN_PROGRESS","BLOCKED","HUMAN_REQUIRED","AWAITING_APPROVAL","COMPLETE"]},"baselineHead":{"type":["string","null"]},"lastVerifiedHead":{"type":["string","null"]},"completedGates":{"type":"array"},"currentTaskIds":{"type":"array"},"pendingTasks":{"type":"array"},"blockers":{"type":"array"},"pendingApprovals":{"type":"array"},"lastRunId":{"type":["string","null"]},"lastExecutionReportId":{"type":["string","null"]},"lastDecisionId":{"type":["string","null"]},"tests":{"enum":["PASS","FAIL","UNKNOWN"]},"lint":{"enum":["PASS","FAIL","UNKNOWN"]},"typecheck":{"enum":["PASS","FAIL","UNKNOWN"]},"build":{"enum":["PASS","FAIL","UNKNOWN"]},"updatedAt":{"type":"string"},"updatedBy":{"type":"string"}},"additionalProperties":false,"schemaVersion":1}